[
  {
    "id": "grintser-1-2",
    "title": "Рамаяна. Книги I-II",
    "translator": "П. А. Гринцер",
    "year": 2006,
    "publisher": "Ладомир : Наука",
    "series": "Литературные памятники",
    "books": "Бала-канда, Айодхья-канда",
    "type": "translation",
    "description": "Первые две книги первого полного русского поэтического академического перевода Рамаяны Вальмики с санскрита.",
    "status": "published",
    "url": ""
  },
  {
    "id": "grintser-3",
    "title": "Рамаяна. Книга III: Араньяканда (книга о лесе)",
    "translator": "П. А. Гринцер",
    "year": 2014,
    "publisher": "Ладомир : Наука",
    "series": "Литературные памятники",
    "books": "Аранья-канда",
    "type": "translation",
    "description": "Третья книга перевода: скитания Рамы, Ситы и Лакшманы в лесах, похищение Ситы Раваной.",
    "status": "published",
    "isbn": "978-5-86218-522-5",
    "url": ""
  },
  {
    "id": "serebryany-4",
    "title": "Рамаяна. Книга IV: Кишкиндхаканда",
    "translator": "С. Д. Серебряный",
    "year": null,
    "publisher": "Ладомир : Наука",
    "series": "Литературные памятники",
    "books": "Кишкиндха-канда",
    "type": "translation",
    "description": "Четвёртая книга: союз с обезьянами, поиски Ситы. Задерживается из-за незавершённой вступительной статьи Серебряного.",
    "status": "blocked",
    "url": ""
  },
  {
    "id": "leonov-5",
    "title": "Рамаяна. Книга V: Сундараканда",
    "translator": "М. В. Леонов",
    "year": null,
    "publisher": "Ладомир : Наука",
    "series": "Литературные памятники",
    "books": "Сундара-канда",
    "type": "translation",
    "description": "Пятая книга: перелёт Ханумана на Ланку. Перевод завершён, комментарии в работе. Ориентир — 2027 год.",
    "status": "in-progress",
    "url": ""
  },
  {
    "id": "leonov-6",
    "title": "Рамаяна. Книга VI: Юддхаканда",
    "translator": "М. В. Леонов",
    "year": null,
    "publisher": "Ладомир : Наука",
    "series": "Литературные памятники",
    "books": "Юддха-канда",
    "type": "translation",
    "description": "Шестая книга: великая битва, гибель Раваны. Черновой литературный перевод готов полностью. Ориентир — 2029 год.",
    "status": "draft-ready",
    "url": ""
  },
  {
    "id": "potapova",
    "title": "Рамаяна (поэтический перевод)",
    "translator": "В. А. Потапова",
    "year": 1986,
    "publisher": "Художественная литература",
    "series": "",
    "books": "Полный текст (избранные книги)",
    "type": "poetic",
    "description": "Первый русский поэтический перевод Рамаяны, выпущенный отдельным изданием. Выполнен по изданию 1986 года.",
    "status": "published",
    "url": "https://samskrtam.ru/parallel-corpus/ramayana-potapovoy.html"
  }
]
